{
  "schema_version": "learning-option-research-v1",
  "evidence_mode": "synthetic",
  "locale": "es",
  "as_of_date": "2026-08-13",
  "source_market_snapshot": "snap-market-sha256-abcdef0123456789abcdef0123456789abcdef0123456789abcdef0123456789",
  "candidate_preferences": {"weekly_time_budget": "unknown", "money_budget": "unknown", "currency": "unknown", "purchase_authorized": false},
  "options": [
    {"option_id": "LO-001", "gap_signal": "terraform_iac", "option_type": "candidate_owned_project", "provider": "Fixture University", "option": "Synthetic infrastructure proof project", "source_title": "Synthetic project brief", "source_date": "2026-08-13", "source_state": "synthetic", "url": "https://example.com/fixtures/project", "geography": "unknown", "availability": "unknown", "role": "unknown", "seniority": "unknown", "current_cost": "not_applicable", "currency": "not_applicable", "tax": "not_applicable", "duration": "5 private days", "duration_basis": "candidate_estimated", "prerequisite": "unknown", "renewal": "not_applicable", "maintenance": "not_applicable", "unknowns": ["current provider availability is synthetic"], "proof_artifact": "Synthetic private infrastructure evidence", "action_gate": {"external_action_authorized": false, "exact_authorization_required": true, "ownership_review": "required", "secrets_review": "required", "confidentiality_review": "required", "customer_data_review": "required", "rights_holder_review": "required", "publication_authorized": false}},
    {"option_id": "LO-002", "gap_signal": "terraform_iac", "option_type": "lab", "provider": "Fixture Learning Platform", "option": "Synthetic infrastructure lab", "source_title": "Synthetic lab outline", "source_date": "2026-08-13", "source_state": "synthetic", "url": "https://example.com/fixtures/lab", "geography": "unknown", "availability": "unknown", "role": "unknown", "seniority": "unknown", "current_cost": "not_applicable", "currency": "not_applicable", "tax": "not_applicable", "duration": "3 private hours", "duration_basis": "candidate_estimated", "prerequisite": "unknown", "renewal": "not_applicable", "maintenance": "not_applicable", "unknowns": ["synthetic fixture"], "proof_artifact": "Synthetic lab notes", "action_gate": {"external_action_authorized": false, "exact_authorization_required": true, "ownership_review": "not_applicable", "secrets_review": "required", "confidentiality_review": "required", "customer_data_review": "required", "rights_holder_review": "not_applicable", "publication_authorized": false}},
    {"option_id": "LO-003", "gap_signal": "kubernetes", "option_type": "course", "provider": "Fixture University", "option": "Synthetic Kubernetes course", "source_title": "Synthetic course catalogue", "source_date": "2026-08-13", "source_state": "synthetic", "url": "https://example.com/fixtures/course", "geography": "unknown", "availability": "unknown", "role": "unknown", "seniority": "unknown", "current_cost": "unknown", "currency": "unknown", "tax": "unknown", "duration": "unknown", "duration_basis": "provider_duration_unknown", "prerequisite": "unknown", "renewal": "unknown", "maintenance": "unknown", "unknowns": ["commercial details synthetic"], "proof_artifact": "Synthetic learning notes", "action_gate": {"external_action_authorized": false, "exact_authorization_required": true, "ownership_review": "not_applicable", "secrets_review": "required", "confidentiality_review": "required", "customer_data_review": "required", "rights_holder_review": "not_applicable", "publication_authorized": false}},
    {"option_id": "LO-004", "gap_signal": "kubernetes", "option_type": "certification", "provider": "Fixture Vendor", "option": "Synthetic Kubernetes certification", "source_title": "Synthetic certification page", "source_date": "2026-08-13", "source_state": "synthetic", "url": "https://example.com/fixtures/certification", "geography": "unknown", "availability": "unknown", "role": "unknown", "seniority": "unknown", "current_cost": "unknown", "currency": "unknown", "tax": "unknown", "duration": "unknown", "duration_basis": "provider_duration_unknown", "prerequisite": "unknown", "renewal": "unknown", "maintenance": "unknown", "unknowns": ["commercial details synthetic"], "proof_artifact": "Synthetic certification preparation record", "action_gate": {"external_action_authorized": false, "exact_authorization_required": true, "ownership_review": "not_applicable", "secrets_review": "required", "confidentiality_review": "required", "customer_data_review": "required", "rights_holder_review": "not_applicable", "publication_authorized": false}},
    {"option_id": "LO-005", "gap_signal": "observability", "option_type": "do_nothing_now", "provider": "none", "option": "Synthetic defer decision", "source_title": "Synthetic no-learning decision", "source_date": "2026-08-13", "source_state": "synthetic", "url": null, "geography": "not_applicable", "availability": "not_applicable", "role": "not_applicable", "seniority": "not_applicable", "current_cost": "not_applicable", "currency": "not_applicable", "tax": "not_applicable", "duration": "not_applicable", "duration_basis": "provider_duration_unknown", "prerequisite": "not_applicable", "renewal": "not_applicable", "maintenance": "not_applicable", "unknowns": [], "proof_artifact": "Synthetic no-action record", "action_gate": {"external_action_authorized": false, "exact_authorization_required": true, "ownership_review": "not_applicable", "secrets_review": "not_applicable", "confidentiality_review": "not_applicable", "customer_data_review": "not_applicable", "rights_holder_review": "not_applicable", "publication_authorized": false}}
  ],
  "privacy_boundary": "identity_free_market_and_provider_evidence_only",
  "no_external_action": true
}
